[
  {
    "id": "performance_improving_fatigue_low",
    "scenario": "Performance improving / fatigue low",
    "athleteProfileId": "intermediate_strength_hypertrophy",
    "status": "research_fixture",
    "performanceTrend": "improving",
    "fatigueState": "low",
    "recoveryState": "good",
    "evidenceQuality": "high",
    "trainingContinuity": "consistent",
    "localLiftSignals": [{ "lift": "bench_press", "signal": "inside_range", "severity": "low" }],
    "systemicSignals": ["good_readiness"],
    "notes": ["Starter case for cautiously earning more stress."],
    "approvalStatus": "draft_requires_aaron_approval"
  },
  {
    "id": "performance_improving_fatigue_high",
    "scenario": "Performance improving / fatigue high",
    "athleteProfileId": "advanced_powerlifting",
    "status": "research_fixture",
    "performanceTrend": "improving",
    "fatigueState": "high",
    "recoveryState": "mixed",
    "evidenceQuality": "moderate",
    "trainingContinuity": "consistent",
    "localLiftSignals": [{ "lift": "squat", "signal": "inside_range", "severity": "low" }],
    "systemicSignals": ["high_soreness", "sleep_disrupted"],
    "notes": ["Tests the principle that progress can be real while cost is rising."],
    "approvalStatus": "draft_requires_aaron_approval"
  },
  {
    "id": "performance_stagnant_fatigue_low",
    "scenario": "Performance stagnant / fatigue low",
    "athleteProfileId": "intermediate_strength_hypertrophy",
    "status": "research_fixture",
    "performanceTrend": "stagnant",
    "fatigueState": "low",
    "recoveryState": "good",
    "evidenceQuality": "moderate",
    "trainingContinuity": "consistent",
    "localLiftSignals": [{ "lift": "row", "signal": "inside_range", "severity": "none" }],
    "systemicSignals": ["good_readiness"],
    "notes": ["Tests whether the lab suggests a small stimulus increase instead of a load jump by default."],
    "approvalStatus": "draft_requires_aaron_approval"
  },
  {
    "id": "performance_stagnant_fatigue_high",
    "scenario": "Performance stagnant / fatigue high",
    "athleteProfileId": "recovery_limited_lifter",
    "status": "research_fixture",
    "performanceTrend": "stagnant",
    "fatigueState": "high",
    "recoveryState": "poor",
    "evidenceQuality": "moderate",
    "trainingContinuity": "consistent",
    "localLiftSignals": [{ "lift": "leg_press", "signal": "dropoff", "severity": "moderate" }],
    "systemicSignals": ["high_soreness", "sleep_disrupted", "high_stress"],
    "notes": ["Tests lower-fatigue intervention before any aggressive progression."],
    "approvalStatus": "draft_requires_aaron_approval"
  },
  {
    "id": "performance_declining_fatigue_high",
    "scenario": "Performance declining / fatigue high",
    "athleteProfileId": "recovery_limited_lifter",
    "status": "research_fixture",
    "performanceTrend": "declining",
    "fatigueState": "high",
    "recoveryState": "poor",
    "evidenceQuality": "high",
    "trainingContinuity": "consistent",
    "localLiftSignals": [
      { "lift": "squat", "signal": "below_range", "severity": "high" },
      { "lift": "bench_press", "signal": "below_range", "severity": "moderate" }
    ],
    "systemicSignals": ["multiple_lifts_down", "high_soreness", "sleep_disrupted"],
    "notes": ["Tests systemic fatigue handling."],
    "approvalStatus": "draft_requires_aaron_approval"
  },
  {
    "id": "one_local_lift_failing",
    "scenario": "One local lift failing",
    "athleteProfileId": "intermediate_strength_hypertrophy",
    "status": "research_fixture",
    "performanceTrend": "mixed",
    "fatigueState": "moderate",
    "recoveryState": "mixed",
    "evidenceQuality": "high",
    "trainingContinuity": "consistent",
    "localLiftSignals": [{ "lift": "bench_press", "signal": "below_range", "severity": "moderate" }],
    "systemicSignals": ["none"],
    "notes": ["Local failure should not automatically become a whole-programme recovery recommendation."],
    "approvalStatus": "draft_requires_aaron_approval"
  },
  {
    "id": "systemic_fatigue_across_multiple_lifts",
    "scenario": "Systemic fatigue across multiple lifts",
    "athleteProfileId": "advanced_powerlifting",
    "status": "research_fixture",
    "performanceTrend": "declining",
    "fatigueState": "high",
    "recoveryState": "poor",
    "evidenceQuality": "high",
    "trainingContinuity": "consistent",
    "localLiftSignals": [
      { "lift": "squat", "signal": "below_range", "severity": "high" },
      { "lift": "deadlift", "signal": "below_range", "severity": "high" },
      { "lift": "bench_press", "signal": "dropoff", "severity": "moderate" }
    ],
    "systemicSignals": ["multiple_lifts_down", "high_soreness", "sleep_disrupted"],
    "notes": ["Systemic evidence case for recovery-biased recommendation."],
    "approvalStatus": "draft_requires_aaron_approval"
  },
  {
    "id": "missed_training_week",
    "scenario": "Missed training week",
    "athleteProfileId": "busy_parent_time_constrained",
    "status": "research_fixture",
    "performanceTrend": "mixed",
    "fatigueState": "moderate",
    "recoveryState": "mixed",
    "evidenceQuality": "low",
    "trainingContinuity": "missed_week",
    "localLiftSignals": [{ "lift": "all", "signal": "none", "severity": "none" }],
    "systemicSignals": ["missed_sessions", "time_constraint"],
    "notes": ["Tests resume-gently behaviour after interruption."],
    "approvalStatus": "draft_requires_aaron_approval"
  },
  {
    "id": "successful_load_progression_productive_fatigue",
    "scenario": "Successful load progression with productive fatigue",
    "athleteProfileId": "intermediate_strength_hypertrophy",
    "status": "research_fixture",
    "performanceTrend": "improving",
    "fatigueState": "moderate",
    "recoveryState": "good",
    "evidenceQuality": "high",
    "trainingContinuity": "consistent",
    "localLiftSignals": [{ "lift": "spider_curl", "signal": "productive_fatigue", "severity": "low" }],
    "systemicSignals": ["good_readiness"],
    "notes": ["Protects the principle: successful progression inside range is not deterioration."],
    "approvalStatus": "draft_requires_aaron_approval"
  },
  {
    "id": "low_training_frequency_constraint",
    "scenario": "Low training frequency constraint",
    "athleteProfileId": "busy_parent_time_constrained",
    "status": "research_fixture",
    "performanceTrend": "stable",
    "fatigueState": "moderate",
    "recoveryState": "mixed",
    "evidenceQuality": "moderate",
    "trainingContinuity": "consistent",
    "localLiftSignals": [{ "lift": "all", "signal": "inside_range", "severity": "none" }],
    "systemicSignals": ["low_frequency", "time_constraint"],
    "notes": ["Tests future frequency-aware stimulus distribution without implementing it in production."],
    "approvalStatus": "draft_requires_aaron_approval"
  },
  {
    "id": "poor_readiness_strong_performance",
    "scenario": "User reports poor readiness but performance is strong",
    "athleteProfileId": "intermediate_strength_hypertrophy",
    "status": "research_fixture",
    "performanceTrend": "improving",
    "fatigueState": "low",
    "recoveryState": "good",
    "evidenceQuality": "high",
    "trainingContinuity": "consistent",
    "localLiftSignals": [
      { "lift": "bench_press", "signal": "above_range", "severity": "moderate" },
      { "lift": "row", "signal": "inside_range", "severity": "low" }
    ],
    "systemicSignals": ["good_readiness"],
    "subjectiveContext": {
      "readiness": "poor",
      "stress": "moderate",
      "sleep": "mixed",
      "motivation": "moderate",
      "soreness": "moderate",
      "safetyFlag": "none",
      "notes": "User feels flat despite strong objective training evidence."
    },
    "notes": ["Objective performance should preserve a mostly positive Coaching State."],
    "approvalStatus": "draft_requires_aaron_approval"
  },
  {
    "id": "feels_great_performance_declining",
    "scenario": "User reports feeling great but performance is declining",
    "athleteProfileId": "advanced_powerlifting",
    "status": "research_fixture",
    "performanceTrend": "declining",
    "fatigueState": "high",
    "recoveryState": "poor",
    "evidenceQuality": "high",
    "trainingContinuity": "consistent",
    "localLiftSignals": [
      { "lift": "squat", "signal": "below_range", "severity": "high" },
      { "lift": "deadlift", "signal": "dropoff", "severity": "moderate" }
    ],
    "systemicSignals": ["multiple_lifts_down"],
    "subjectiveContext": {
      "readiness": "great",
      "stress": "low",
      "sleep": "good",
      "motivation": "high",
      "soreness": "low",
      "safetyFlag": "none",
      "notes": "User reports feeling excellent despite clear objective decline."
    },
    "notes": ["Subjective optimism must not override declining objective performance."],
    "approvalStatus": "draft_requires_aaron_approval"
  },
  {
    "id": "high_stress_objective_stable",
    "scenario": "User reports high stress but objective data is stable",
    "athleteProfileId": "busy_parent_time_constrained",
    "status": "research_fixture",
    "performanceTrend": "stable",
    "fatigueState": "moderate",
    "recoveryState": "mixed",
    "evidenceQuality": "moderate",
    "trainingContinuity": "consistent",
    "localLiftSignals": [{ "lift": "leg_press", "signal": "inside_range", "severity": "low" }],
    "systemicSignals": ["time_constraint"],
    "subjectiveContext": {
      "readiness": "mixed",
      "stress": "high",
      "sleep": "mixed",
      "motivation": "moderate",
      "soreness": "moderate",
      "safetyFlag": "none",
      "notes": "High life stress is present but training behaviour is stable."
    },
    "notes": ["Stress should soften state slightly without dominating stable objective evidence."],
    "approvalStatus": "draft_requires_aaron_approval"
  },
  {
    "id": "low_motivation_consistent_sessions",